{
  "spec_version": "1.5.0",
  "since": "1.2.0",
  "name": "dedupe/no-key-skips",
  "description": "With no dedupeKey on the candidate the check skips rather than guessing an identity.",
  "policy": {
    "specVersion": "1.0.0",
    "checks": [
      {
        "id": "consent"
      },
      {
        "id": "dedupe"
      }
    ]
  },
  "tests": [
    {
      "description": "a candidate with no dedupeKey is delivered; the check stands aside in the trace",
      "input": {
        "user": {
          "id": "u1",
          "consent": true,
          "proactiveEnabled": true,
          "mode": "normal",
          "intensity": "normal",
          "timezone": "Europe/Istanbul",
          "createdAt": "2026-01-01T00:00:00Z"
        },
        "candidate": {
          "id": "c1",
          "type": "reminder",
          "priority": "normal",
          "surfaces": [
            "push"
          ]
        },
        "now": "2026-09-05T12:00:00Z"
      },
      "expect": {
        "allowed": true,
        "trace": [
          "consent",
          "dedupe"
        ]
      }
    }
  ]
}
