{
  "spec_version": "1.5.0",
  "since": "1.1.0",
  "name": "quiet-hours/crosses-midnight-by-day",
  "description": "A window belongs to the day it opens on, so Friday 18:00 to 02:00 silences Saturday morning. Saturday has no window of its own, so the carry is the only thing that can explain the silence.",
  "policy": {
    "specVersion": "1.0.0",
    "checks": [
      {
        "id": "consent"
      },
      {
        "id": "quietHours"
      }
    ]
  },
  "tests": [
    {
      "description": "Friday 19:00 local rejects",
      "input": {
        "user": {
          "id": "u1",
          "consent": true,
          "proactiveEnabled": true,
          "mode": "normal",
          "intensity": "normal",
          "timezone": "Europe/Istanbul",
          "quietHours": {
            "default": null,
            "days": {
              "fri": {
                "start": "18:00",
                "end": "02:00"
              }
            }
          },
          "createdAt": "2026-01-01T00:00:00Z"
        },
        "candidate": {
          "id": "c1",
          "type": "reminder",
          "priority": "normal",
          "surfaces": [
            "push",
            "feed"
          ]
        },
        "now": "2026-09-04T16:00:00Z"
      },
      "expect": {
        "allowed": false,
        "trace": [
          "consent",
          "quietHours"
        ],
        "rejectedBy": "quietHours"
      }
    },
    {
      "description": "Saturday 01:30 local rejects, carried from Friday",
      "input": {
        "user": {
          "id": "u1",
          "consent": true,
          "proactiveEnabled": true,
          "mode": "normal",
          "intensity": "normal",
          "timezone": "Europe/Istanbul",
          "quietHours": {
            "default": null,
            "days": {
              "fri": {
                "start": "18:00",
                "end": "02:00"
              }
            }
          },
          "createdAt": "2026-01-01T00:00:00Z"
        },
        "candidate": {
          "id": "c1",
          "type": "reminder",
          "priority": "normal",
          "surfaces": [
            "push",
            "feed"
          ]
        },
        "now": "2026-09-04T22:30:00Z"
      },
      "expect": {
        "allowed": false,
        "trace": [
          "consent",
          "quietHours"
        ],
        "rejectedBy": "quietHours"
      }
    },
    {
      "description": "Saturday 02:30 local is past the end, passes",
      "input": {
        "user": {
          "id": "u1",
          "consent": true,
          "proactiveEnabled": true,
          "mode": "normal",
          "intensity": "normal",
          "timezone": "Europe/Istanbul",
          "quietHours": {
            "default": null,
            "days": {
              "fri": {
                "start": "18:00",
                "end": "02:00"
              }
            }
          },
          "createdAt": "2026-01-01T00:00:00Z"
        },
        "candidate": {
          "id": "c1",
          "type": "reminder",
          "priority": "normal",
          "surfaces": [
            "push",
            "feed"
          ]
        },
        "now": "2026-09-04T23:30:00Z"
      },
      "expect": {
        "allowed": true,
        "trace": [
          "consent",
          "quietHours"
        ]
      }
    },
    {
      "description": "Sunday 01:30 local passes: Saturday had no window to carry",
      "input": {
        "user": {
          "id": "u1",
          "consent": true,
          "proactiveEnabled": true,
          "mode": "normal",
          "intensity": "normal",
          "timezone": "Europe/Istanbul",
          "quietHours": {
            "default": null,
            "days": {
              "fri": {
                "start": "18:00",
                "end": "02:00"
              }
            }
          },
          "createdAt": "2026-01-01T00:00:00Z"
        },
        "candidate": {
          "id": "c1",
          "type": "reminder",
          "priority": "normal",
          "surfaces": [
            "push",
            "feed"
          ]
        },
        "now": "2026-09-05T22:30:00Z"
      },
      "expect": {
        "allowed": true,
        "trace": [
          "consent",
          "quietHours"
        ]
      }
    },
    {
      "description": "Friday 15:00 local is before the window, passes",
      "input": {
        "user": {
          "id": "u1",
          "consent": true,
          "proactiveEnabled": true,
          "mode": "normal",
          "intensity": "normal",
          "timezone": "Europe/Istanbul",
          "quietHours": {
            "default": null,
            "days": {
              "fri": {
                "start": "18:00",
                "end": "02:00"
              }
            }
          },
          "createdAt": "2026-01-01T00:00:00Z"
        },
        "candidate": {
          "id": "c1",
          "type": "reminder",
          "priority": "normal",
          "surfaces": [
            "push",
            "feed"
          ]
        },
        "now": "2026-09-04T12:00:00Z"
      },
      "expect": {
        "allowed": true,
        "trace": [
          "consent",
          "quietHours"
        ]
      }
    }
  ]
}
